{
  "$schema": "https://json-schema.org/draft/2020-12/schema",
  "title": "LLM Wiki Eval Report",
  "type": "object",
  "required": [
    "$schema",
    "vault",
    "generated_at",
    "artifact_kind",
    "producer",
    "source_command",
    "source_revision",
    "source_tree_fingerprint",
    "input_fingerprints",
    "schema_version",
    "artifact_status",
    "retention_policy",
    "encoding",
    "currentness",
    "policy",
    "status",
    "max_score",
    "total_score",
    "pages"
  ],
  "properties": {
    "$schema": {
      "const": "ops/schemas/eval-report.schema.json"
    },
    "vault": {
      "type": "string"
    },
    "generated_at": {
      "type": "string"
    },
    "artifact_kind": {
      "type": "string",
      "minLength": 1
    },
    "producer": {
      "type": "string",
      "minLength": 1
    },
    "source_command": {
      "type": "string",
      "minLength": 1
    },
    "source_revision": {
      "type": "string",
      "minLength": 1
    },
    "source_tree_fingerprint": {
      "type": "string",
      "minLength": 1
    },
    "input_fingerprints": {
      "type": "object",
      "additionalProperties": {
        "type": "string",
        "minLength": 1
      }
    },
    "schema_version": {
      "type": "integer",
      "minimum": 1
    },
    "artifact_status": {
      "type": "string",
      "enum": [
        "current",
        "archived",
        "stale",
        "unknown"
      ]
    },
    "retention_policy": {
      "type": "string",
      "enum": [
        "ephemeral",
        "canonical_report",
        "archive"
      ]
    },
    "encoding": {
      "type": "string",
      "enum": [
        "utf-8"
      ]
    },
    "currentness": {
      "type": "object",
      "additionalProperties": false,
      "required": [
        "status",
        "checked_at"
      ],
      "properties": {
        "status": {
          "type": "string",
          "enum": [
            "current",
            "stale",
            "unknown",
            "invalid"
          ]
        },
        "checked_at": {
          "type": "string",
          "pattern": "^\\d{4}-\\d{2}-\\d{2}T\\d{2}:\\d{2}:\\d{2}Z$"
        }
      }
    },
    "policy": {
      "type": "object",
      "required": [
        "path",
        "version"
      ],
      "properties": {
        "path": {
          "type": "string"
        },
        "version": {
          "type": "integer"
        }
      }
    },
    "status": {
      "enum": [
        "pass",
        "fail"
      ]
    },
    "max_score": {
      "type": "integer"
    },
    "total_score": {
      "type": "integer"
    },
    "pages": {
      "type": "array",
      "items": {
        "type": "object",
        "required": [
          "page",
          "score",
          "max_score",
          "results"
        ],
        "properties": {
          "page": {
            "type": "string"
          },
          "score": {
            "type": "integer"
          },
          "max_score": {
            "type": "integer"
          },
          "results": {
            "type": "array",
            "items": {
              "type": "object"
            }
          }
        }
      }
    }
  }
}
