{
  "$schema": "ops/schemas/eval-report.schema.json",
  "vault": ".",
  "generated_at": "2026-04-14T15:27:47Z",
  "artifact_kind": "wiki_eval_report",
  "producer": "ops.scripts.wiki_eval",
  "source_command": "python -m ops.scripts.wiki_eval",
  "source_revision": "unknown",
  "source_tree_fingerprint": "legacy_backfill_run_20260415_mechanism_planning_gate_second_retry_candidate_eval",
  "input_fingerprints": {
    "policy": "legacy_backfill",
    "schema": "legacy_backfill",
    "artifact_envelope_schema": "legacy_backfill",
    "legacy_original_sha256": "fde149144d7a0437d4756d64dd9c7454366431a984c42c9fd2411cb541059ae2"
  },
  "schema_version": 1,
  "artifact_status": "archived",
  "retention_policy": "archive",
  "encoding": "utf-8",
  "currentness": {
    "status": "current",
    "checked_at": "2026-04-14T15:27:47Z"
  },
  "policy": {
    "path": "ops/policies/wiki-maintainer-policy.yaml",
    "version": 4
  },
  "status": "pass",
  "max_score": 1716,
  "total_score": 1716,
  "pages": [
    {
      "page": "system/system-raw-registry/wiki/ai-compute-control.md",
      "score": 9,
      "max_score": 9,
      "results": [
        {
          "eval": "frontmatter_contract",
          "pass": true
        },
        {
          "eval": "required_sections_present",
          "pass": true
        },
        {
          "eval": "source_trace_present",
          "pass": true
        },
        {
          "eval": "source_trace_targets_exist",
          "pass": true
        },
        {
          "eval": "link_integration",
          "pass": true
        },
        {
          "eval": "high_severity_open_questions_within_budget",
          "pass": true
        },
        {
          "eval": "medium_severity_open_questions_within_budget",
          "pass": true
        },
        {
          "eval": "broken_link_free",
          "pass": true
        },
        {
          "eval": "placeholder_discipline",
          "pass": true
        }
      ]
    },
    {
      "page": "system/system-raw-registry/wiki/ai-execution.md",
      "score": 9,
      "max_score": 9,
      "results": [
        {
          "eval": "frontmatter_contract",
          "pass": true
        },
        {
          "eval": "required_sections_present",
          "pass": true
        },
        {
          "eval": "source_trace_present",
          "pass": true
        },
        {
          "eval": "source_trace_targets_exist",
          "pass": true
        },
        {
          "eval": "link_integration",
          "pass": true
        },
        {
          "eval": "high_severity_open_questions_within_budget",
          "pass": true
        },
        {
          "eval": "medium_severity_open_questions_within_budget",
          "pass": true
        },
        {
          "eval": "broken_link_free",
          "pass": true
        },
        {
          "eval": "placeholder_discipline",
          "pass": true
        }
      ]
    },
    {
      "page": "system/system-raw-registry/wiki/coffee.md",
      "score": 9,
      "max_score": 9,
      "results": [
        {
          "eval": "frontmatter_contract",
          "pass": true
        },
        {
          "eval": "required_sections_present",
          "pass": true
        },
        {
          "eval": "source_trace_present",
          "pass": true
        },
        {
          "eval": "source_trace_targets_exist",
          "pass": true
        },
        {
          "eval": "link_integration",
          "pass": true
        },
        {
          "eval": "high_severity_open_questions_within_budget",
          "pass": true
        },
        {
          "eval": "medium_severity_open_questions_within_budget",
          "pass": true
        },
        {
          "eval": "broken_link_free",
          "pass": true
        },
        {
          "eval": "placeholder_discipline",
          "pass": true
        }
      ]
    },
    {
      "page": "wiki/concept--ai-capability-claims-verification.md",
      "score": 9,
      "max_score": 9,
      "results": [
        {
          "eval": "frontmatter_contract",
          "pass": true
        },
        {
          "eval": "required_sections_present",
          "pass": true
        },
        {
          "eval": "source_trace_present",
          "pass": true
        },
        {
          "eval": "source_trace_targets_exist",
          "pass": true
        },
        {
          "eval": "link_integration",
          "pass": true
        },
        {
          "eval": "high_severity_open_questions_within_budget",
          "pass": true
        },
        {
          "eval": "medium_severity_open_questions_within_budget",
          "pass": true
        },
        {
          "eval": "broken_link_free",
          "pass": true
        },
        {
          "eval": "placeholder_discipline",
          "pass": true
        }
      ]
    },
    {
      "page": "wiki/concept--ai-compute-control.md",
      "score": 9,
      "max_score": 9,
      "results": [
        {
          "eval": "frontmatter_contract",
          "pass": true
        },
        {
          "eval": "required_sections_present",
          "pass": true
        },
        {
          "eval": "source_trace_present",
          "pass": true
        },
        {
          "eval": "source_trace_targets_exist",
          "pass": true
        },
        {
          "eval": "link_integration",
          "pass": true
        },
        {
          "eval": "high_severity_open_questions_within_budget",
          "pass": true
        },
        {
          "eval": "medium_severity_open_questions_within_budget",
          "pass": true
        },
        {
          "eval": "broken_link_free",
          "pass": true
        },
        {
          "eval": "placeholder_discipline",
          "pass": true
        }
      ]
    },
    {
      "page": "wiki/concept--ai-ran.md",
      "score": 9,
      "max_score": 9,
      "results": [
        {
          "eval": "frontmatter_contract",
          "pass": true
        },
        {
          "eval": "required_sections_present",
          "pass": true
        },
        {
          "eval": "source_trace_present",
          "pass": true
        },
        {
          "eval": "source_trace_targets_exist",
          "pass": true
        },
        {
          "eval": "link_integration",
          "pass": true
        },
        {
          "eval": "high_severity_open_questions_within_budget",
          "pass": true
        },
        {
          "eval": "medium_severity_open_questions_within_budget",
          "pass": true
        },
        {
          "eval": "broken_link_free",
          "pass": true
        },
        {
          "eval": "placeholder_discipline",
          "pass": true
        }
      ]
    },
    {
      "page": "system/concept--anti-slop-wiki-governance.md",
      "score": 9,
      "max_score": 9,
      "results": [
        {
          "eval": "frontmatter_contract",
          "pass": true
        },
        {
          "eval": "required_sections_present",
          "pass": true
        },
        {
          "eval": "source_trace_present",
          "pass": true
        },
        {
          "eval": "source_trace_targets_exist",
          "pass": true
        },
        {
          "eval": "link_integration",
          "pass": true
        },
        {
          "eval": "high_severity_open_questions_within_budget",
          "pass": true
        },
        {
          "eval": "medium_severity_open_questions_within_budget",
          "pass": true
        },
        {
          "eval": "broken_link_free",
          "pass": true
        },
        {
          "eval": "placeholder_discipline",
          "pass": true
        }
      ]
    },
    {
      "page": "system/concept--artifact-contracts.md",
      "score": 9,
      "max_score": 9,
      "results": [
        {
          "eval": "frontmatter_contract",
          "pass": true
        },
        {
          "eval": "required_sections_present",
          "pass": true
        },
        {
          "eval": "source_trace_present",
          "pass": true
        },
        {
          "eval": "source_trace_targets_exist",
          "pass": true
        },
        {
          "eval": "link_integration",
          "pass": true
        },
        {
          "eval": "high_severity_open_questions_within_budget",
          "pass": true
        },
        {
          "eval": "medium_severity_open_questions_within_budget",
          "pass": true
        },
        {
          "eval": "broken_link_free",
          "pass": true
        },
        {
          "eval": "placeholder_discipline",
          "pass": true
        }
      ]
    },
    {
      "page": "system/concept--binary-evals.md",
      "score": 9,
      "max_score": 9,
      "results": [
        {
          "eval": "frontmatter_contract",
          "pass": true
        },
        {
          "eval": "required_sections_present",
          "pass": true
        },
        {
          "eval": "source_trace_present",
          "pass": true
        },
        {
          "eval": "source_trace_targets_exist",
          "pass": true
        },
        {
          "eval": "link_integration",
          "pass": true
        },
        {
          "eval": "high_severity_open_questions_within_budget",
          "pass": true
        },
        {
          "eval": "medium_severity_open_questions_within_budget",
          "pass": true
        },
        {
          "eval": "broken_link_free",
          "pass": true
        },
        {
          "eval": "placeholder_discipline",
          "pass": true
        }
      ]
    },
    {
      "page": "wiki/concept--coffee-brew-chemistry.md",
      "score": 9,
      "max_score": 9,
      "results": [
        {
          "eval": "frontmatter_contract",
          "pass": true
        },
        {
          "eval": "required_sections_present",
          "pass": true
        },
        {